{
  "$schema": "https://json-schema.org/draft/2020-12/schema",
  "$id": "https://autonomous-dev.local/schemas/artifacts/security-findings/1.0.json",
  "title": "SecurityFindings 1.0",
  "description": "Security findings artifact emitted by security-reviewer-style plugins. See TDD-022 §6.",
  "type": "object",
  "additionalProperties": false,
  "required": ["scan_id", "produced_by", "produced_at", "summary", "findings"],
  "properties": {
    "scan_id": { "type": "string", "pattern": "^[a-zA-Z0-9_-]+$" },
    "produced_by": { "type": "string", "pattern": "^[a-z][a-z0-9-]*$" },
    "produced_at": { "type": "string", "format": "date-time" },
    "summary": { "$ref": "#/$defs/FindingsSummary" },
    "findings": {
      "type": "array",
      "items": { "$ref": "#/$defs/SecurityFinding" }
    }
  },
  "$defs": {
    "FindingsSummary": {
      "type": "object",
      "additionalProperties": false,
      "required": ["total", "by_severity"],
      "properties": {
        "total": { "type": "integer", "minimum": 0 },
        "by_severity": {
          "type": "object",
          "additionalProperties": false,
          "properties": {
            "critical": { "type": "integer", "minimum": 0, "default": 0 },
            "high": { "type": "integer", "minimum": 0, "default": 0 },
            "medium": { "type": "integer", "minimum": 0, "default": 0 },
            "low": { "type": "integer", "minimum": 0, "default": 0 },
            "info": { "type": "integer", "minimum": 0, "default": 0 }
          }
        }
      }
    },
    "SecurityFinding": {
      "type": "object",
      "additionalProperties": false,
      "required": ["id", "severity", "title", "file", "line"],
      "properties": {
        "id": { "type": "string", "minLength": 1 },
        "severity": { "enum": ["critical", "high", "medium", "low", "info"] },
        "title": { "type": "string", "minLength": 1 },
        "description": { "type": "string" },
        "file": { "type": "string", "minLength": 1 },
        "line": { "type": "integer", "minimum": 1 },
        "rule_id": { "type": "string" },
        "remediation": { "type": "string" }
      }
    }
  }
}
